<!ELEMENT bakery (product+)>
<!ELEMENT product (name, category, price)>
<!ELEMENT name (#PCDATA)>
<!ELEMENT category (#PCDATA)>
<!ELEMENT price (#PCDATA)>
